{
  "$schema": "http://json-schema.org/draft-07/schema#",
  "$id": "https://xtone.dev/ai-delivery/schemas/v1/requirements.schema.json",
  "$comment": "T-011 I/O契約スキーマDB（FLD-, data_source_id: 0f997761-9259-4f76-9056-3f209e3a3afc）を真実の源とする本実装（#126 / B-01）。warn_and_document のため undecided を追加保持（T-002）。project_name / overview は実務上の補助フィールドとして任意で許容。",
  "title": "Requirements",
  "description": "要件定義フェーズの成果物。requirements-analyst Subagent が生成する。",
  "type": "object",
  "required": [
    "scope",
    "representative_use_cases",
    "functional_requirements",
    "non_functional_requirements",
    "domain_tags",
    "stakeholders",
    "client_approval"
  ],
  "properties": {
    "project_name": { "type": "string", "description": "案件名（補助・任意）" },
    "overview": { "type": "string", "description": "何を/なぜ（補助・任意）" },
    "scope": {
      "type": "object",
      "description": "MVPスコープの区切り（DP-001 / DP-003）。Must/Should/Could を振り分ける。must は1件以上、各要件に一意ID。",
      "required": ["must"],
      "properties": {
        "must": {
          "type": "array",
          "minItems": 1,
          "items": {
            "type": "object",
            "required": ["id"],
            "properties": { "id": { "type": "string" }, "title": { "type": "string" } },
            "additionalProperties": true
          }
        },
        "should": { "type": "array", "items": { "type": "object", "additionalProperties": true } },
        "could": { "type": "array", "items": { "type": "object", "additionalProperties": true } }
      },
      "additionalProperties": true
    },
    "representative_use_cases": {
      "type": "array",
      "description": "代表ユースケース（DP-002）。各要素に id と name。",
      "minItems": 1,
      "items": {
        "type": "object",
        "required": ["id", "name"],
        "properties": {
          "id": { "type": "string" },
          "name": { "type": "string" },
          "kind": { "type": "string", "enum": ["core", "sub"] }
        },
        "additionalProperties": true
      }
    },
    "functional_requirements": {
      "type": "array",
      "description": "機能要件。各要件に description。",
      "minItems": 1,
      "items": {
        "type": "object",
        "required": ["description"],
        "properties": { "id": { "type": "string" }, "description": { "type": "string" } },
        "additionalProperties": true
      }
    },
    "non_functional_requirements": {
      "type": "array",
      "description": "非機能要件（DP-008 セキュリティ/MFA 等）。performance/security/availability などでグループ化。",
      "items": {
        "type": "object",
        "required": ["category", "description"],
        "properties": {
          "category": { "type": "string", "enum": ["performance", "security", "availability", "maintainability", "other"] },
          "description": { "type": "string" }
        },
        "additionalProperties": true
      }
    },
    "domain_tags": {
      "type": "array",
      "description": "案件が属するドメインタグ（T-008 業界軸10ドメインから選択、複数可）。",
      "minItems": 1,
      "items": { "type": "string" }
    },
    "stakeholders": {
      "type": "object",
      "description": "ステークホルダー（T-005）。client + pm + lead が必須。",
      "required": ["client", "pm", "lead"],
      "properties": {
        "client": { "type": "string" },
        "pm": { "type": "string" },
        "lead": { "type": "string" }
      },
      "additionalProperties": true
    },
    "client_approval": {
      "type": "object",
      "description": "クライアント承認。approved=false の間は設計フェーズに進めない（warn_and_document で可視化）。",
      "required": ["approved"],
      "properties": {
        "approved": { "type": "boolean" },
        "approved_by": { "type": ["string", "null"] },
        "approved_at": { "type": ["string", "null"], "format": "date-time" }
      },
      "additionalProperties": true
    },
    "undecided": {
      "type": "array",
      "description": "未決の判断ポイントID（DP-XXX）。warn_and_document の検出対象（追加保持フィールド, T-002）。",
      "items": { "type": "string", "pattern": "^DP-[0-9]+$" }
    }
  },
  "additionalProperties": true
}
