{
  "project_name": "日々（hibi）ライフスタイルメディア デジタル版リニューアル",
  "overview": "12,000 本のアーカイブを持つ老舗ライフスタイル雑誌のデジタル版。SEO 流入と無料 + 有料会員制で収益化する。",
  "scope": {
    "must": [
      { "id": "SCP-001", "title": "匿名読者・無料会員・有料会員の 3 層の閲覧制御" },
      { "id": "SCP-002", "title": "編集者 CMS（Markdown + リッチエディタ、公開予約、差し戻し）" },
      { "id": "SCP-003", "title": "記事 / 特集 / 著者のメタ管理と関連記事の手動・自動併用推薦" },
      { "id": "SCP-004", "title": "フリーワード検索 + 著者 / カテゴリ / タグ / 期間 / 有料無料絞り込み" },
      { "id": "SCP-005", "title": "OGP 画像自動生成と構造化データ（schema.org）対応" },
      { "id": "SCP-006", "title": "サイトマップ自動生成（特集・著者・タグページも含む）" },
      { "id": "SCP-007", "title": "12,000 本アーカイブ移行（旧 CMS JSON エクスポートから取り込み）" },
      { "id": "SCP-008", "title": "GA4 + BigQuery への日次計測ログ連携" }
    ],
    "should": [
      { "id": "SCP-101", "title": "スポンサード記事（PR 表記強制）と GAM 広告枠" },
      { "id": "SCP-102", "title": "ニュースレター購読" },
      { "id": "SCP-103", "title": "編集者・広告営業の社内 SSO（Google Workspace）" }
    ],
    "could": [
      { "id": "SCP-201", "title": "限定オンラインイベントの申し込み連携" },
      { "id": "SCP-202", "title": "著者ページの執筆者検索" }
    ]
  },
  "representative_use_cases": [
    { "id": "UC-001", "name": "匿名読者の SNS 流入 → 記事閲覧（OGP・SEO 経由）", "kind": "core" },
    { "id": "UC-002", "name": "無料会員の登録 → 有料へのアップグレード", "kind": "core" },
    { "id": "UC-003", "name": "編集者の記事執筆 → 公開予約", "kind": "core" },
    { "id": "UC-004", "name": "特集の編成と公開", "kind": "core" },
    { "id": "UC-005", "name": "フリーワード検索 + 絞り込み", "kind": "core" },
    { "id": "UC-006", "name": "計測データの GA4 + BigQuery 連携", "kind": "sub" },
    { "id": "UC-007", "name": "スポンサード記事の出稿", "kind": "sub" }
  ],
  "functional_requirements": [
    { "id": "FR-001", "description": "無料会員はメール + PW または Google ログイン、有料会員は決済 SaaS との連携で会員ステータスを管理する" },
    { "id": "FR-002", "description": "編集者・広告営業は社内 SSO（Google Workspace）でログインする" },
    { "id": "FR-003", "description": "ソーシャルログインを既存有料アカウントに後から紐付けできる" },
    { "id": "FR-004", "description": "Markdown ベース + リッチエディタの併用で記事を執筆し、公開予約・下書き共有・差し戻し・修正履歴を扱う" },
    { "id": "FR-005", "description": "記事に カテゴリ・タグ・著者・公開日時・有料無料フラグ・関連記事のメタを持たせる" },
    { "id": "FR-006", "description": "特集は記事を束ね、トップに大型ビジュアル + 編集者ことばを表示する" },
    { "id": "FR-007", "description": "フリーワード検索（本文 + メタ）と複数条件の絞り込みを 500ms 以内で返す" },
    { "id": "FR-008", "description": "関連記事は編集者の手動推薦と自動推薦を併用する" },
    { "id": "FR-009", "description": "記事・特集・著者ページごとに OGP 画像を自動生成し、schema.org 構造化データを出力する" },
    { "id": "FR-010", "description": "サイトマップを特集・著者・タグページも含めて自動生成する" },
    { "id": "FR-011", "description": "閲覧時間・スクロール深度・読了率を計測し、GA4 + 自社 BigQuery へ連携する" },
    { "id": "FR-012", "description": "PR 表記を強制したスポンサード記事と GAM 広告枠を扱う" }
  ],
  "non_functional_requirements": [
    { "category": "performance", "description": "特集公開時 1 万 PV/分のピークでも 1 秒以内の応答を維持する" },
    { "category": "performance", "description": "サイト内検索の結果表示を 500ms 以内に収める" },
    { "category": "maintainability", "description": "JAMstack 寄り（静的化 + ISR）を検討し、編集 → 公開のリードタイムを最小化する" },
    { "category": "availability", "description": "公開記事ページは 99.95% の稼働率を目標とする" },
    { "category": "security", "description": "決済情報を含む会員情報は厳格管理し、個人情報保護法に準拠する" },
    { "category": "other", "description": "AMP は廃止予定のため対応不要" }
  ],
  "domain_tags": ["media", "content", "cms", "search", "seo", "analytics", "advertising"],
  "stakeholders": {
    "client": "日々編集部 編集長 / デジタル担当 / 広告営業",
    "pm": "受託側 PM（1 名）",
    "lead": "受託側テックリード（1 名）",
    "engineers": "BE 1 名 / FE 2 名 / インフラ 1 名",
    "designer": "デザイン 1 名"
  },
  "client_approval": {
    "approved": false,
    "approved_by": null,
    "approved_at": null
  },
  "undecided": [
    "DP-003"
  ]
}
