{
  "project_name": "鎌倉工芸社 コーポレートサイトリニューアル",
  "overview": "老舗工芸メーカーのコーポレートサイト。BtoB 取引先と BtoC エンドユーザー・採用候補・メディアの窓口になる。会員機能・決済は不要、速さ・SEO・ブランド体験が要件の中核。",
  "scope": {
    "must": [
      { "id": "SCP-001", "title": "製品カタログ（カテゴリ × 商品、写真複数枚 + スペック表）" },
      { "id": "SCP-002", "title": "ブランドストーリー・年表・職人インタビューの記事ページ" },
      { "id": "SCP-003", "title": "店舗・取扱店一覧（地図表示）" },
      { "id": "SCP-004", "title": "採用情報（職種別、職人インタビューと連動）" },
      { "id": "SCP-005", "title": "プレスリリース・お知らせ（公開日時管理）" },
      { "id": "SCP-006", "title": "問い合わせフォーム 4 種（取引先 / 一般 / 採用 / メディア）" },
      { "id": "SCP-007", "title": "ヘッドレス CMS と Markdown + 画像複数の編集体験" },
      { "id": "SCP-008", "title": "全 SSG + OGP 画像事前生成 + 構造化データ対応" }
    ],
    "should": [
      { "id": "SCP-101", "title": "ヒートマップ計測（Microsoft Clarity）" },
      { "id": "SCP-102", "title": "WCAG 2.1 AA 相当のバリアフリー対応" }
    ],
    "could": [
      { "id": "SCP-201", "title": "多言語対応（英語・中国語）" }
    ]
  },
  "representative_use_cases": [
    { "id": "UC-001", "name": "取引先担当が製品カタログ閲覧 → 問い合わせ送信", "kind": "core" },
    { "id": "UC-002", "name": "エンドユーザーがブランドストーリー閲覧 → 取扱店検索", "kind": "core" },
    { "id": "UC-003", "name": "採用候補者が職人インタビュー閲覧 → 採用応募", "kind": "core" },
    { "id": "UC-004", "name": "メディア記者がプレスリリース閲覧 → 取材依頼送信", "kind": "core" },
    { "id": "UC-005", "name": "広報担当が CMS で記事・製品情報を更新", "kind": "core" },
    { "id": "UC-006", "name": "問い合わせ受信 → 確認メール送信 + 担当部署振り分け", "kind": "sub" }
  ],
  "functional_requirements": [
    { "id": "FR-001", "description": "エンドユーザー向け会員機能は提供しない（問い合わせのみ）" },
    { "id": "FR-002", "description": "広報担当（社内）の CMS ログインはメール + PW + IP 制限で保護する" },
    { "id": "FR-003", "description": "製品カタログをカテゴリ × 商品で構成し、写真複数枚とスペック表を表示する" },
    { "id": "FR-004", "description": "ブランドストーリー・年表・職人インタビューを Markdown + 画像複数で編集する" },
    { "id": "FR-005", "description": "店舗・取扱店を地図上に表示する" },
    { "id": "FR-006", "description": "採用情報を職種別に管理し、職人インタビューと連動表示する" },
    { "id": "FR-007", "description": "プレスリリース・お知らせを公開日時管理付きで配信する" },
    { "id": "FR-008", "description": "取引先 / 一般 / 採用 / メディア の 4 種問い合わせフォームを提供し、reCAPTCHA でスパムを抑止する" },
    { "id": "FR-009", "description": "問い合わせ受信時に確認メール自動送信と担当部署への振り分け通知を行う" },
    { "id": "FR-010", "description": "全ページを SSG で配信し、製品・記事ページごとに OGP 画像を事前生成する" },
    { "id": "FR-011", "description": "Organization / Product / NewsArticle の構造化データを出力する" },
    { "id": "FR-012", "description": "Google Analytics 4 と問い合わせコンバージョン追跡を実装する" }
  ],
  "non_functional_requirements": [
    { "category": "performance", "description": "PageSpeed Insights モバイル 90 点以上を目標とする" },
    { "category": "performance", "description": "月間 30 万 PV を想定し、ピーク時も 1 秒以内の応答を維持する" },
    { "category": "maintainability", "description": "Next.js + ヘッドレス CMS（microCMS / Contentful）構成で運用負荷を最小化する" },
    { "category": "availability", "description": "公開ページは 99.95% の稼働率を目標とする（Vercel / Cloudflare Pages 想定）" },
    { "category": "security", "description": "問い合わせフォームの個人情報は長期保存せず、担当部署への振り分け後は所定期間で削除する" },
    { "category": "other", "description": "WCAG 2.1 AA 相当のバリアフリーに配慮する" }
  ],
  "domain_tags": ["corporate-site", "cms", "static-site", "seo", "ogp", "form", "accessibility"],
  "stakeholders": {
    "client": "鎌倉工芸社 広報部長 / 広報担当",
    "pm": "受託側 PM（1 名）",
    "lead": "受託側テックリード（1 名）",
    "engineers": "FE 2 名",
    "designer": "デザイン 1 名"
  },
  "client_approval": {
    "approved": false,
    "approved_by": null,
    "approved_at": null
  },
  "undecided": [
    "DP-006"
  ]
}
