{
  "project_name": "みらいの種 教育バウチャー管理プラットフォーム",
  "overview": "NPO 法人が家計困難世帯の子ども向け塾・習い事費用バウチャーを発行・管理する。自治体・寄付者・教育委員会への説明責任が要件の中核。",
  "scope": {
    "must": [
      { "id": "SCP-001", "title": "保護者会員・教室・NPO 事務局・教育委員会・寄付者の 5 ロール認証" },
      { "id": "SCP-002", "title": "保護者からのオンライン申請と書類アップロード" },
      { "id": "SCP-003", "title": "事務局の審査ワークフロー（一次・二次・承認 / 却下・差し戻し）" },
      { "id": "SCP-004", "title": "RBAC（事務局内で審査担当 / 経理 / 管理者の権限分離）" },
      { "id": "SCP-005", "title": "教室向け管理画面（受領状況・月次請求書発行）" },
      { "id": "SCP-006", "title": "教育委員会向け統計ダッシュボード（個人特定不可）" },
      { "id": "SCP-007", "title": "月次請求書・寄付者向け使途報告・年次レポートの PDF 出力" },
      { "id": "SCP-008", "title": "申請・審査関連通知（メール + SMS）" },
      { "id": "SCP-009", "title": "個人情報アクセス含む全操作の監査ログ（4 年保管）" }
    ],
    "should": [
      { "id": "SCP-101", "title": "会計 SaaS（マネーフォワード / freee）への請求データ CSV 連携" },
      { "id": "SCP-102", "title": "事務局向け申請キュー残数 Slack 通知" }
    ],
    "could": [
      { "id": "SCP-201", "title": "寄付者向けエピソード閲覧ページ" }
    ]
  },
  "representative_use_cases": [
    { "id": "UC-001", "name": "保護者の新規申請 → 書類アップロード → 審査結果通知", "kind": "core" },
    { "id": "UC-002", "name": "事務局の審査キュー処理（一次 / 二次 / 承認）", "kind": "core" },
    { "id": "UC-003", "name": "教室がバウチャーを受領 → 月次請求書を発行", "kind": "core" },
    { "id": "UC-004", "name": "寄付者向け使途報告 PDF の月次自動発行", "kind": "core" },
    { "id": "UC-005", "name": "教育委員会担当が統計ダッシュボードを閲覧", "kind": "core" },
    { "id": "UC-006", "name": "事務局管理者が監査ログを確認", "kind": "sub" },
    { "id": "UC-007", "name": "差し戻し → 保護者が再申請", "kind": "sub" }
  ],
  "functional_requirements": [
    { "id": "FR-001", "description": "保護者会員はメール + PW + SMS（OTP）認証を必須とする" },
    { "id": "FR-002", "description": "提携教室はメール + PW、NPO 事務局は社内 SSO + MFA 必須、教育委員会・寄付者は閲覧専用アカウント（メール + PW）で認証する" },
    { "id": "FR-003", "description": "保護者は家計状況・世帯構成・対象児童・希望教室を含むオンライン申請フォームを送信し、必要書類をアップロードする" },
    { "id": "FR-004", "description": "事務局の審査ワークフロー（受付 → 一次審査 → 二次審査 → 承認 / 却下 → 差し戻し / 再申請）を提供する" },
    { "id": "FR-005", "description": "事務局内 RBAC（審査担当 / 経理 / 管理者）で参照・編集できる範囲を分離する" },
    { "id": "FR-006", "description": "教室向け管理画面でバウチャー受領状況・利用者リストを表示し、月次請求書 PDF を自動発行する" },
    { "id": "FR-007", "description": "教育委員会向けに、個人特定不可な統計ダッシュボード（属性別・地域別利用状況など）を提供する" },
    { "id": "FR-008", "description": "寄付者向け使途報告 PDF と年次レポートを月次・年次で自動発行する" },
    { "id": "FR-009", "description": "会計 SaaS（マネーフォワード / freee）への請求データ CSV 連携を提供する" },
    { "id": "FR-010", "description": "申請受理・審査結果・差し戻し・有効期限切れ・教室向け請求締め日リマインドを メール + SMS で通知する" },
    { "id": "FR-011", "description": "事務局向けに申請キュー残数 / 差し戻し滞留のメール + Slack 通知を行う" },
    { "id": "FR-012", "description": "全操作（個人情報閲覧・編集・承認）の監査ログを別 DB に保管し、4 年間削除不可とする" },
    { "id": "FR-013", "description": "児童の個人情報取扱いに親の同意ログを必須化する" }
  ],
  "non_functional_requirements": [
    { "category": "security", "description": "所得情報・児童個人情報をマイナンバー級の厳格管理で扱い、個人情報保護法に準拠する" },
    { "category": "security", "description": "全操作の監査ログを 4 年間削除不可で保管し、独立 DB に保存する" },
    { "category": "security", "description": "国内サーバ限定。海外リージョンへの転送を禁止する" },
    { "category": "availability", "description": "審査・請求ワークフロー API は月次締め日付近で 99.9% 以上の稼働率を維持する" },
    { "category": "maintainability", "description": "自治体予算・寄付金による継続運用を前提に、ベンダーロックインを避け差し替え可能な構成にする" },
    { "category": "other", "description": "メールアドレスを持たない保護者層が一定数いるため SMS チャネルを必須通知手段として確保する" }
  ],
  "domain_tags": ["education", "public-sector", "voucher", "admin-dashboard", "rbac", "audit-log", "reporting", "kyc-light"],
  "stakeholders": {
    "client": "NPO みらいの種 事務局長 / システム担当 / 寄付者リレーション担当",
    "pm": "受託側 PM（1 名）",
    "lead": "受託側テックリード（1 名）",
    "engineers": "BE 2 名 / FE 2 名"
  },
  "client_approval": {
    "approved": false,
    "approved_by": null,
    "approved_at": null
  },
  "undecided": [
    "DP-004",
    "DP-011"
  ]
}
