{
  "project_name": "サンセット.koto アパレル D2C アプリ",
  "overview": "ユニセックスアパレルブランドの自社 EC・アプリ。会員 → 購入 → コミュニティ → リピートまで一気通貫の顧客体験を提供する。",
  "scope": {
    "must": [
      { "id": "SCP-001", "title": "会員登録・ログイン（メール + ソーシャル）" },
      { "id": "SCP-002", "title": "商品マスタ（サイズ × 色バリエーション、プリオーダー）" },
      { "id": "SCP-003", "title": "カート・チェックアウト・決済（Stripe / Apple Pay / Google Pay / 後払い）" },
      { "id": "SCP-004", "title": "受注・発送ステータス管理と通知（メール + push）" },
      { "id": "SCP-005", "title": "フリーワード検索 + 絞り込み（在庫切れは後ろに回す）" },
      { "id": "SCP-006", "title": "コミュニティ投稿・フィード・モデレーション" },
      { "id": "SCP-007", "title": "特集記事と商品紐付け" },
      { "id": "SCP-008", "title": "運営スタッフの管理画面（商品・在庫・受注・モデレーション）" }
    ],
    "should": [
      { "id": "SCP-101", "title": "ホスト会員制度（限定タグ・サンプリング応募）" },
      { "id": "SCP-102", "title": "BigQuery への日次データ連携" },
      { "id": "SCP-103", "title": "セール開始 / 在庫復活通知（オプトイン）" }
    ],
    "could": [
      { "id": "SCP-201", "title": "海外発送対応" },
      { "id": "SCP-202", "title": "LINE 通知連携" }
    ]
  },
  "representative_use_cases": [
    { "id": "UC-001", "name": "新規会員登録（ソーシャルログイン含む）", "kind": "core" },
    { "id": "UC-002", "name": "商品検索 → カート投入 → 決済完了", "kind": "core" },
    { "id": "UC-003", "name": "コミュニティ投稿の作成・モデレーション", "kind": "core" },
    { "id": "UC-004", "name": "受注後の発送ステータス通知", "kind": "core" },
    { "id": "UC-005", "name": "運営による商品マスタ・在庫管理", "kind": "core" },
    { "id": "UC-006", "name": "特集記事と商品レコメンド", "kind": "sub" },
    { "id": "UC-007", "name": "ホスト会員によるサンプリング応募", "kind": "sub" }
  ],
  "functional_requirements": [
    { "id": "FR-001", "description": "メール + パスワード、Google / Apple / LINE ログインに対応する" },
    { "id": "FR-002", "description": "退会時にコミュニティ投稿を「匿名化して残す」「全削除」から選べる" },
    { "id": "FR-003", "description": "運営スタッフは MFA 必須、一般会員は任意とする" },
    { "id": "FR-004", "description": "商品はサイズ × 色のバリエーション管理を行い、プリオーダー（受注生産）も扱う" },
    { "id": "FR-005", "description": "商品詳細にスタッフ私物のスタイリング写真とコメントを表示する" },
    { "id": "FR-006", "description": "特集記事を複数の商品にひも付け、商品詳細・特集記事の両方からレコメンド表示する" },
    { "id": "FR-007", "description": "フリーワード検索とカテゴリ・サイズ・色・価格帯・在庫の絞り込みを提供し、在庫切れ商品は後ろに回す" },
    { "id": "FR-008", "description": "クレジットカード（Stripe）、Apple Pay、Google Pay、後払い（NP / Paidy）を提供する" },
    { "id": "FR-009", "description": "受注確定・発送・配送中・配達完了をメール + アプリ push で通知する" },
    { "id": "FR-010", "description": "セール開始・在庫復活通知をオプトインで受け取れる" },
    { "id": "FR-011", "description": "コミュニティ投稿は NG ワード自動フィルタと通報 → 運営チェックフローでモデレーションする" },
    { "id": "FR-012", "description": "ホスト会員制度を設け、限定タグ付与とサンプリング応募権を付与する" },
    { "id": "FR-013", "description": "DAU/MAU・回遊・コンバージョン・商品別売上などのアクセス解析を行い、BigQuery へ日次連携する" }
  ],
  "non_functional_requirements": [
    { "category": "performance", "description": "ピーク時（セール開始直後）に同時アクセス 5,000 ユーザーまで応答時間 1 秒以内を維持する" },
    { "category": "security", "description": "クレジットカード番号は自社 DB に保持せず、PCI DSS スコープを最小化する" },
    { "category": "security", "description": "個人情報は分析データから分離し、個人情報保護法に準拠して取り扱う" },
    { "category": "availability", "description": "受注・決済まわりは月間 99.9% 以上の稼働率を目標とする" },
    { "category": "maintainability", "description": "ベンダーロックインを避けるため、決済以外の主要機能は差し替え可能な抽象に揃える" },
    { "category": "other", "description": "国内リージョン（AWS 東京 or GCP 東京）でホスティングし、海外リージョンは使わない" }
  ],
  "domain_tags": ["ec", "d2c", "community", "content", "payment", "analytics"],
  "stakeholders": {
    "client": "サンセット.koto マーケ責任者 / CS リーダー",
    "pm": "受託側 PM（1 名）",
    "lead": "受託側テックリード（1 名）",
    "designer": "デザイン 1 名",
    "engineers": "BE 2 名 / FE 2 名 / iOS 1 名 / Android 1 名"
  },
  "client_approval": {
    "approved": false,
    "approved_by": null,
    "approved_at": null
  },
  "undecided": [
    "DP-001",
    "DP-008"
  ]
}
