{
  "project_name": "やまびこモビリティ（地方自治体カーシェア）",
  "overview": "地方都市の超小型 EV を 12 拠点で 24 時間無人運用するカーシェア。市民の足の補完と観光客利用の両立を目指す。",
  "scope": {
    "must": [
      { "id": "SCP-001", "title": "メール + PW 認証と KYC（免許証画像 + 顔写真 + OCR）" },
      { "id": "SCP-002", "title": "拠点・日時指定の予約と地図上のリアルタイム空き状況表示" },
      { "id": "SCP-003", "title": "車両 QR を読み取って利用開始 / 終了する" },
      { "id": "SCP-004", "title": "時間制 + 距離制の料金計算と決済（クレジットカード）" },
      { "id": "SCP-005", "title": "車両 IoT からの位置・走行距離・バッテリ取得（1 分間隔）" },
      { "id": "SCP-006", "title": "オペレーター向け管理画面（車両 / 会員 / 利用履歴）" },
      { "id": "SCP-007", "title": "予約・利用関連通知（push + SMS）" },
      { "id": "SCP-008", "title": "拠点間乗り捨て対応" }
    ],
    "should": [
      { "id": "SCP-101", "title": "観光客向けコンビニ後払い" },
      { "id": "SCP-102", "title": "オペレーター窓口での代行入会" },
      { "id": "SCP-103", "title": "利用中ユーザーへの一斉連絡（積雪・通行止め等）" }
    ],
    "could": [
      { "id": "SCP-201", "title": "法人カード対応" },
      { "id": "SCP-202", "title": "走行ルートの可視化（自分の履歴）" }
    ]
  },
  "representative_use_cases": [
    { "id": "UC-001", "name": "新規会員登録 + KYC（自動 OCR + 即時審査）", "kind": "core" },
    { "id": "UC-002", "name": "拠点・日時を選んで予約する", "kind": "core" },
    { "id": "UC-003", "name": "QR を読み取って利用開始 → 別拠点で返却", "kind": "core" },
    { "id": "UC-004", "name": "利用終了時の料金計算と決済", "kind": "core" },
    { "id": "UC-005", "name": "オペレーターが車両状態をモニタリング", "kind": "core" },
    { "id": "UC-006", "name": "予約確認 / リマインドの SMS 通知", "kind": "sub" },
    { "id": "UC-007", "name": "窓口でオペレーターが代行入会する", "kind": "sub" }
  ],
  "functional_requirements": [
    { "id": "FR-001", "description": "メール + PW 認証と、運転免許証画像 + 顔写真 + OCR による本人確認（KYC）を実施する" },
    { "id": "FR-002", "description": "観光客向けに即日承認（自動 OCR + 即時審査）フローを提供する" },
    { "id": "FR-003", "description": "高齢ユーザー向けに、窓口でのオペレーター代行入会を可能にする" },
    { "id": "FR-004", "description": "ソーシャルログインは提供しない（自治体方針）" },
    { "id": "FR-005", "description": "拠点・日時を指定した予約を当日 + 90 分前まで受け付け、地図上で空き状況をリアルタイム表示する" },
    { "id": "FR-006", "description": "スマホアプリの QR コード（Web 予約者はメール送付の QR）を車両リーダーにかざして利用開始・終了する" },
    { "id": "FR-007", "description": "利用中の延長・キャンセルおよび拠点間乗り捨てに対応する" },
    { "id": "FR-008", "description": "車両 IoT デバイスから 1 分間隔で位置・走行距離・バッテリ残量を取得・保管する" },
    { "id": "FR-009", "description": "時間制（30 分単位）+ 距離制の料金計算を行い、利用終了時に決済を確定する" },
    { "id": "FR-010", "description": "クレジットカード（3D セキュア対応）を基本とし、観光客向けにコンビニ後払いを提供する" },
    { "id": "FR-011", "description": "予約確認 / リマインド / 返却催促 / 延長確認を push と SMS で通知する（主要通知は SMS 必須）" },
    { "id": "FR-012", "description": "オペレーター向け管理画面で車両一覧（位置・バッテリ・故障フラグ）と会員管理を提供する" },
    { "id": "FR-013", "description": "整備員向けに巡回・点検記録の入力 UI を提供する" }
  ],
  "non_functional_requirements": [
    { "category": "performance", "description": "車両 IoT データを 1 分間隔で 60 台分受信し、5 秒以内にダッシュボードへ反映する" },
    { "category": "performance", "description": "拠点位置情報の精度は 5m 以内に保つ" },
    { "category": "security", "description": "個人情報・運転免許証画像は国内サーバに限定し、海外リージョン転送を禁止する" },
    { "category": "availability", "description": "24 時間無人運用のため決済・利用開始系 API は 99.9% 以上の稼働率を目標とする" },
    { "category": "maintainability", "description": "自治体予算による継続運用を前提に、特定ベンダー依存を避け差し替え可能な構成にする" },
    { "category": "other", "description": "高齢ユーザー比率が高いことを踏まえ、SMS チャネルを必須通知手段として確保する" }
  ],
  "domain_tags": ["maas", "mobility", "iot", "geo", "payment", "kyc", "public-sector"],
  "stakeholders": {
    "client": "やまびこ市 企画課 / 第三セクター事務局",
    "pm": "受託側 PM（1 名）",
    "lead": "受託側テックリード（1 名）",
    "engineers": "BE 2 名 / FE 1 名 / iOS 1 名 / Android 1 名 / IoT 1 名"
  },
  "client_approval": {
    "approved": false,
    "approved_by": null,
    "approved_at": null
  },
  "undecided": [
    "DP-002",
    "DP-014"
  ]
}
