{
  "project_name": "打刻ノート 中小企業向け勤怠管理 SaaS",
  "overview": "10〜100 名規模の中小企業向け、軽量な勤怠管理 SaaS。打刻 → 月末承認 → 給与 CSV 連携を中核に、シンプルさを最優先する。",
  "scope": {
    "must": [
      { "id": "SCP-001", "title": "メール + PW 認証と SAML / OIDC による IdP SSO 連携" },
      { "id": "SCP-002", "title": "マルチテナント（1 社 = 1 テナント、データ完全分離）" },
      { "id": "SCP-003", "title": "打刻・休憩・休暇申請とシフト / フレックス / 裁量労働の対応" },
      { "id": "SCP-004", "title": "RBAC（従業員 / 承認者 / 経理 / 管理者 / 自社サポート）と承認ルート自動構築" },
      { "id": "SCP-005", "title": "経理向け月次締め画面と給与 CSV エクスポート" },
      { "id": "SCP-006", "title": "残業時間自動計算と 36 協定超過アラート" },
      { "id": "SCP-007", "title": "全勤怠データ操作の監査ログ（3 年保管・改ざん不可）" },
      { "id": "SCP-008", "title": "打刻リマインド・承認待ち通知（メール + Slack）" }
    ],
    "should": [
      { "id": "SCP-101", "title": "パスワードレス（メールマジックリンク）認証" },
      { "id": "SCP-102", "title": "Google / Outlook カレンダー連携で休暇予定同期" },
      { "id": "SCP-103", "title": "PWA でのスマホ最適化" }
    ],
    "could": [
      { "id": "SCP-201", "title": "勤怠分析ダッシュボード（残業傾向・部署別）" }
    ]
  },
  "representative_use_cases": [
    { "id": "UC-001", "name": "従業員がワンタップで出勤・退勤打刻", "kind": "core" },
    { "id": "UC-002", "name": "従業員が休暇申請 → 承認者が承認", "kind": "core" },
    { "id": "UC-003", "name": "経理担当が月次締めをして給与 CSV をエクスポート", "kind": "core" },
    { "id": "UC-004", "name": "管理者が社員マスタ・組織図・権限を設定", "kind": "core" },
    { "id": "UC-005", "name": "IdP SSO 経由でテナントにログイン", "kind": "core" },
    { "id": "UC-006", "name": "36 協定超過時に本人・管理者へアラート", "kind": "sub" },
    { "id": "UC-007", "name": "監査ログを管理者が閲覧", "kind": "sub" }
  ],
  "functional_requirements": [
    { "id": "FR-001", "description": "メール + PW 認証と、SAML / OIDC による Google Workspace / Microsoft Entra ID との SSO 連携を提供する" },
    { "id": "FR-002", "description": "管理者は MFA 必須、一般従業員は任意とする" },
    { "id": "FR-003", "description": "1 アカウント = 1 社のマルチテナントを実現し、同一メールアドレスで複数テナントに所属できる" },
    { "id": "FR-004", "description": "全レコードにテナント ID を持たせ、テナント間のデータを完全分離する" },
    { "id": "FR-005", "description": "出勤 / 退勤 / 休憩開始 / 終了の打刻を 1 タップで完了させ、打刻忘れは承認フロー付きで事後修正できる" },
    { "id": "FR-006", "description": "シフト勤務・フレックス・裁量労働の 3 形態に対応する" },
    { "id": "FR-007", "description": "残業時間を自動計算し、36 協定超過時に本人と管理者にアラートする" },
    { "id": "FR-008", "description": "有給 / 振休 / 特別休暇の残数を管理し、休暇申請を扱う" },
    { "id": "FR-009", "description": "RBAC（従業員 / 承認者 / 経理 / 管理者 / 自社サポート）と組織図に基づく承認ルート自動構築を行う" },
    { "id": "FR-010", "description": "経理向け月次締め画面と、マネーフォワード給与 / freee 人事労務 / 弥生給与形式の給与 CSV エクスポートを提供する" },
    { "id": "FR-011", "description": "Google / Outlook カレンダー連携で休暇予定を同期する" },
    { "id": "FR-012", "description": "打刻リマインド・承認待ち・36 協定超過の通知をメール + Slack で行う" },
    { "id": "FR-013", "description": "勤怠データの編集・削除・承認をすべて監査ログに記録し、3 年保管・改ざん不可で運用する" }
  ],
  "non_functional_requirements": [
    { "category": "performance", "description": "月初・月末ピーク時にも応答 1 秒以内を維持する（1 テナント最大 100 名 × 数百テナント）" },
    { "category": "security", "description": "給与情報を含む個人情報を厳格管理し、テナント間で漏洩しない設計を担保する" },
    { "category": "security", "description": "監査ログは改ざん不可で 3 年保管、勤怠・帳票データは 7 年保管とする（法的要件）" },
    { "category": "availability", "description": "勤怠 API は月次締め日付近で 99.95% の稼働率を目標とする" },
    { "category": "maintainability", "description": "IdP・通知・連携先のアダプタは差し替え可能にし、テナントごとの設定で切り替えられる" },
    { "category": "other", "description": "国内クラウド（AWS 東京）に限定し、海外リージョンへの保管・転送を禁止する" }
  ],
  "domain_tags": ["saas", "multi-tenant", "admin-dashboard", "rbac", "audit-log", "hr", "integration"],
  "stakeholders": {
    "client": "自社プロダクト（プロダクトオーナー兼任）",
    "pm": "プロダクトマネージャー（1 名）",
    "lead": "テックリード（1 名）",
    "engineers": "BE 2 名 / FE 2 名 / インフラ 1 名",
    "cs": "セールス兼 CS 1 名"
  },
  "client_approval": {
    "approved": false,
    "approved_by": null,
    "approved_at": null
  },
  "undecided": [
    "DP-005",
    "DP-008",
    "DP-011"
  ]
}
